ID	Name	Description	CAWE_ID	STRIDE Type(s)
108	Session Hijacking due to Insufficient Session ID length (J2EE)	The software utilizes J2EE but sets an insufficient session ID length. A small session ID is easier to guess. If an attacker were to guess the session ID, they would be able to elevate their privileges	6	
109	Unauthorized Code Execution due to Improperly Neutralized XQuery Expressions	The software fails to neutralize special elements in an XQuery Expression. This can allow an attacker to modify the query, gaining access to application data.	652	
110	Information Exposure due to File Descriptor Leak 	An attacker can access application data, because a process fails to close sensitive file descriptors before invoking a child process. This allows the child process to run with the privileges of the parent process.	403	
111	Malicious Activity due to Improper Following of a Certificates Chain of Trust	The application does not follow the chaing of trust for a certificate correctly, allowing an attacker to spoof a certificate and elevate privileges or execute unautorized code.	296	
112	Authentication Bypass due to Missing OpenSSL validation	The attacker can bypass authentication mechanisms when using an openSSL certificate because the software does not implement the proper functions to ensure the certificate satisfies all security requirements.	599	
113	Leaked data due to a predictable observable state	An attacker can gain information about a system by discovering predicatable patterns about observable states. This can then be used by attackers to further exploit the system.	341	
114	Unintended behaviors due to insecure input/output control	The system does not restrict functionality of an input/output control. An attacker can gain access to this, which allows the attacker to execute any functionality the control provides.	782	
115	Unintended behavior due to external control of system settings	An attacker can gain access to system configuration settings and modify them to cause system disruption, unintended, and potentially malicious behaviors	15	
116	Leaked data due to inadequate encryption	The system does not protect sensitive data with a strong enough encryption algorithm. An attacker can gain access to sensitive data by brute forcing weak encryption alogrithms.	326	
117	Leaked data due to insecure backups	The system may backup files in a way that puts them outside the intended control sphere. An attacker can then have access to these files, which can contain sensitive information about the system.	530	
118	Leaked data through sent data	An attacker can gain sensitive information about a system by observing system data channels. This data can then be used to further exploit the system.	201	
119	Unintended behavior due to deserialization of untrusted data	The system deserializes untrusted data without verifying the resulting data will be valid. This can allow an attacker to perform a wide range of unintended behaviors by modifying serialized data that will later be deserialized and executed. 	502	
120	Leaked application data due to improperly stored passwords	The system stores passwords in a format that is recoverable. An attacker can gain access to user passwords that  can then be used to impersonate the user.	257	
121	Unintended behavior due to lack of integrity checks	The system fails to verify the integrity of data during transmission. This can result in an attacker sending modified or corrupt data to the system that can result in unintended functionality.	353	
122	Leaked application data due to lack of encryption	An attacker can gain access to sensitive data by sniffing unencrypted communication channels on a network. 	319	
123	Unintended behavior due to lack of proper error handling	An attacker can put the system into an unintended state by utilizing ignored error conditions. This can lead to unintended logic and behavior of the system	390	
124	Leaked application data due to error message	An attacker can gain sensitive information about a system by analyzing error messages. This data can then be used for a later attack.	209	
125	Unauthorized access due to improper link resolution	The system does not prevent a filename from identifying links or shortcuts to other locations. This can allow attackers to access unintended resources and filesystems. 	59	
126	Unintended behavior due to improper neutralization of special SQL elements	An attacker can use improperly neutralized special elements to modify intended SQL commands. This allows an attacker to perform unintended operations on SQL databases. 	89	
127	Unauthorized access due to improper verification of sources	An attacker can spoof a source and gain the full functionality intended for that source. 	346	